{"bounds":[-93.52,41.98,-93.42,42.07],"width":1000,"height":900,"timelapse":null,"frames":[{"date":"2026-06-01","rgb":"frames/2026-06-01_rgb.jpg","ndvi":null,"clear_frac":1.0},{"date":"2026-06-02","rgb":"frames/2026-06-02_rgb.jpg","ndvi":null,"clear_frac":0.646},{"date":"2026-06-04","rgb":"frames/2026-06-04_rgb.jpg","ndvi":null,"clear_frac":0.582},{"date":"2026-06-09","rgb":"frames/2026-06-09_rgb.jpg","ndvi":null,"clear_frac":0.762},{"date":"2026-06-12","rgb":"frames/2026-06-12_rgb.jpg","ndvi":null,"clear_frac":0.951},{"date":"2026-06-14","rgb":"frames/2026-06-14_rgb.jpg","ndvi":null,"clear_frac":0.609},{"date":"2026-06-22","rgb":"frames/2026-06-22_rgb.jpg","ndvi":null,"clear_frac":0.663},{"date":"2026-06-24","rgb":"frames/2026-06-24_rgb.jpg","ndvi":null,"clear_frac":0.925},{"date":"2026-06-29","rgb":"frames/2026-06-29_rgb.jpg","ndvi":null,"clear_frac":0.968},{"date":"2026-07-07","rgb":"frames/2026-07-07_rgb.jpg","ndvi":null,"clear_frac":0.776},{"date":"2026-07-11","rgb":"frames/2026-07-11_rgb.jpg","ndvi":null,"clear_frac":1.0},{"date":"2026-07-12","rgb":"frames/2026-07-12_rgb.jpg","ndvi":null,"clear_frac":0.934},{"date":"2026-07-14","rgb":"frames/2026-07-14_rgb.jpg","ndvi":null,"clear_frac":1.0},{"date":"2026-07-17","rgb":"frames/2026-07-17_rgb.jpg","ndvi":null,"clear_frac":0.938},{"date":"2026-07-19","rgb":"frames/2026-07-19_rgb.jpg","ndvi":null,"clear_frac":0.934},{"date":"2026-07-27","rgb":"frames/2026-07-27_rgb.jpg","ndvi":null,"clear_frac":0.893},{"date":"2026-07-29","rgb":"frames/2026-07-29_rgb.jpg","ndvi":null,"clear_frac":0.505},{"date":"2026-08-01","rgb":"frames/2026-08-01_rgb.jpg","ndvi":null,"clear_frac":0.654},{"date":"2026-08-03","rgb":"frames/2026-08-03_rgb.jpg","ndvi":null,"clear_frac":0.617},{"date":"2026-08-08","rgb":"frames/2026-08-08_rgb.jpg","ndvi":null,"clear_frac":1.0},{"date":"2026-08-11","rgb":"frames/2026-08-11_rgb.jpg","ndvi":null,"clear_frac":0.961},{"date":"2026-08-20","rgb":"frames/2026-08-20_rgb.jpg","ndvi":null,"clear_frac":1.0},{"date":"2026-08-21","rgb":"frames/2026-08-21_rgb.jpg","ndvi":null,"clear_frac":0.764},{"date":"2026-08-26","rgb":"frames/2026-08-26_rgb.jpg","ndvi":null,"clear_frac":0.987},{"date":"2026-08-28","rgb":"frames/2026-08-28_rgb.jpg","ndvi":null,"clear_frac":1.0},{"date":"2026-09-02","rgb":"frames/2026-09-02_rgb.jpg","ndvi":null,"clear_frac":0.893}]}